,territory_id,date,scraped_at,url,territory_name,state_code,excerpts,edition,is_extra_edition,txt_url
54,2803005,2024-05-16,2024-05-17T05:09:09.950189,https://querido-diario.nyc3.cdn.digitaloceanspaces.com/2803005/2024-05-16/5cbe322111258f09422d99dcbfec16f3e17dbdb5.pdf,Itabaianinha,SE,"- Nº 1538 PREFEITURA MUNICIPAL DE ITABAIANINHA

DIÁRIO OFICIAL DO MUNICÍPIO

DECRETO

Praça Floriano Peixoto CEP: 49.290-000
TELEFONE: (79) 3544-1291
EMAIL:

DIÁRIO OFICIAL DO MUNICÍPIO

 

 

 

MUNICÍPIO DE ITABAIANINHA 

REFEITURA MUNICIPAL DE ITABAIANINHA 

 

1 

 

DECRETO Nº201/2024 

DE 16 DE MAIO DE 2024 

 

 

Regulamenta a lei federal nº 
14.129/2021, de 29 de março de 2021, 
no município de Itabaianinha/SE e 
estabelece outras providências. 

 

 

O PREFEITO MUNICIPAL DE ITABAININHA, ESTADO DE SERGIPE, no uso das 

atribuições que lhe são conferidas pela Lei Orgânica do Município, em consonância 

com a Lei Federal nº 14.129/2021;  

 

 

DECRETA: 

 

DISPOSIÇÕES GERAIS 

 

  

Art. 1°- Fica instituído no âmbito da Administração Direta e Indireta 

o Programa Municipal de Governo Digital. 

 

Art. 2º - O Programa Municipal de Governo Digital terá as seguintes 

diretrizes: 

I. A manutenção dos serviços digitais disponíveis, bem como a garantia da sua 

evolução tecnológica;",1538,False,https://querido-diario.nyc3.cdn.digitaloceanspaces.com/2803005/2024-05-16/5cbe322111258f09422d99dcbfec16f3e17dbdb5.txt
55,4113700,2024-05-16,2024-05-17T04:11:53.133169,https://querido-diario.nyc3.cdn.digitaloceanspaces.com/4113700/2024-05-16/c683f4525b9f908fba27188226d9d160a2311c13.pdf,Londrina,PR,"poderão interpor recurso, no prazo de 2 (dois) dias úteis, a partir da 
publicação deste, pelo email cei.milton.gavetti@hotmail.com , com cópia para o e-mail gestaofinanceira@edu.londrina.pr.gov.br Após este prazo não 
será recebido mais nenhum questionamento do processo em questão, o qual seguirá para contratação. 

 
CÂMARA 

JORNAL DO LEGISLATIVO 
ATOS LEGISLATIVOS 

ATO 
ATO DA MESA Nº 5, DE 9 DE MAIO DE 2024 
 
SÚMULA: Regulamenta, no âmbito da Câmara Municipal de Londrina, a Lei Federal nº 14.129, de 29 de março de 2021, e estabelece critérios 
administrativos para instituição do Programa Câmara Digital. 
 
A MESA EXECUTIVA DA CÂMARA MUNICIPAL DE LONDRINA, ESTADO DO PARANÁ, NO USO DE SUAS ATRIBUIÇÕES LEGAIS, 
 

RESOLVE: 
 
Art. 1º Fica instituído no âmbito da Câmara Municipal de Londrina o Programa Câmara Digital. 
 
Art. 2º O Programa Câmara Digital, instituído no âmbito do Poder Legislativo local, terá as seguintes diretrizes: 
 
I – implementação das rotinas de trabalho e atribuições",5198,False,https://querido-diario.nyc3.cdn.digitaloceanspaces.com/4113700/2024-05-16/c683f4525b9f908fba27188226d9d160a2311c13.txt
56,3556305,2024-05-18,2024-05-19T06:35:43.515638,https://querido-diario.nyc3.cdn.digitaloceanspaces.com/3556305/2024-05-18/e2855fcd6b74f319f0ef7b715550dd695dc11bdb.pdf,Valparaíso,SP,"/3 - 18/05/2024

Art. 8º A digitalização de documentos para a inserção no
SEI/CIDADES observará as disposições:
I - da Lei Federal nº 12.682, de 9 de julho de 2012, que dispõe sobre a
e l a b o r a ç ã o  e  o  a r q u i v a m e n t o  d e  d o c u m e n t o s  e m  m e i o s
eletromagnéticos;
II - da Lei Federal nº 13.460, de 26 de junho de 2017, que dispõe
sobre participação, proteção e defesa dos direitos do usuário dos
serviços públicos da administração pública; e
III - da Lei Federal nº 14.129, de 29 de março de 2021, que dispõe
sobre princípios, regras e instrumentos para o Governo Digital e para o
aumento da eficiência pública e dá outras providências.
 
Art. 9º A digitalização de documentos recebidos ou produzidos no
âmbito da Administração Pública Municipal será acompanhada da
conferência da integridade do documento.
§ 1º A conferência da integridade a que se refere o “caput” deste artigo
deverá registrar se houve exibição de documento original, de cópia
autenticada por serviços",506,False,https://querido-diario.nyc3.cdn.digitaloceanspaces.com/3556305/2024-05-18/e2855fcd6b74f319f0ef7b715550dd695dc11bdb.txt
57,2303709,2024-05-20,2024-06-04T07:20:14.711184,https://querido-diario.nyc3.cdn.digitaloceanspaces.com/2303709/2024-05-20/ed7b1094a5a2e279752928b18bb1376fac2be597.pdf,Caucaia,CE,"VALLEY, em consonância 

com o art. 218 da Constituição Federal de 1988. § 1º Aplicam-se as disposições desta Lei às atividades de ciência, tecnologia e inovação, sem 

prejuízo da aplicação das normas gerais da Lei Federal nº 10.973, de 2 de dezembro de 2004 (Lei de Inovação), do Decreto Federal nº 9.283, de 7 de 

fevereiro de 2018 (Novo Marco Legal de Ciência, Tecnologia e Inovação), do Decreto Federal nº 9.854, de 25 de junho de 2019 (Plano Nacional de 

Internet das Coisas), da Lei Federal nº 14.129, de 29 de março de 2021 (Governo Digital), da Lei Complementar Federal nº 182,  de 1º de junho de 

2021 (Marco Legal das Startups e do Empreendedorismo Inovador), e suas regulamentações. § 2º O Centro de Apoio ao Trabalho, 

Empreendedorismo e Qualificação - CATEQ é a responsável por estabelecer, promover e executar a Política de Inovação e Desenvolvimento 

Tecnológico do Município de Caucaia, por meio da efetiva interação entre a Administração Pública municipal, universidades, centros de pesquisa",2956,False,https://querido-diario.nyc3.cdn.digitaloceanspaces.com/2303709/2024-05-20/ed7b1094a5a2e279752928b18bb1376fac2be597.txt
58,3551702,2024-05-20,2024-05-21T06:13:26.917800,https://querido-diario.nyc3.cdn.digitaloceanspaces.com/3551702/2024-05-20/497101f76c19816e59eeee618aaa8cb3c56bac91.pdf,Sertãozinho,SP,"preservação e integridade dos dados.

Art. 8º - A digitalização de documentos para a inserção no SEI/CIDADES observará as disposições:
I  -  da  Lei  Federal  nº  12.682,  de  9  de  julho  de  2012,  que  dispõe  sobre  a  elaboração  e  o  arquivamento  de

documentos em meios eletromagnéticos;
II - da Lei Federal nº 13.460, de 26 de junho de 2017, que dispõe sobre participação, proteção e defesa dos

direitos do usuário dos serviços públicos da administração pública; e
III - da Lei Federal nº 14.129, de 29 de março de 2021, que dispõe sobre princípios, regras e instrumentos para o

Governo Digital e para o aumento da eficiência pública e dá outras providências.
Art. 9º - A digitalização de documentos recebidos ou produzidos no âmbito da Administração Pública Municipal

será acompanhada da conferência da integridade do documento.
§ 1º - A conferência da integridade a que se refere o “caput” deste artigo deverá registrar se houve exibição de

documento  original,  de  cópia  autenticada  por",1076,False,https://querido-diario.nyc3.cdn.digitaloceanspaces.com/3551702/2024-05-20/497101f76c19816e59eeee618aaa8cb3c56bac91.txt
59,2804706,2024-05-22,2024-05-29T22:24:50.997804,https://querido-diario.nyc3.cdn.digitaloceanspaces.com/2804706/2024-05-22/566a7776ed6488afef85e714991185d7e7894063.pdf,Nossa Senhora de Lourdes,SE,"DECRETO Nº 29/2024 DE 21 DE MAIO DE 2024  - Estabelece regras e diretrizes no tocante à participação, proteção e defesa dos usuários de
serviços públicos da Administração Pública, institui o Sistema de Ouvidoria do Poder Executivo Municipal e do Poder Legislativo Municipal, nos
termos da Lei Federal nº 13.460, de 26 de junho de 2017, que dispõe sobre e dá outras providências.

● DECRETO Nº 30/2024 DE 21 DE MAIO DE 2024  - Estabelece regras e diretrizes no tocante à aplicação da Lei Federal nº 14.129/2021, de 29
de março de 2021 – que trata sobre os princípios, regras e instrumentos para o Governo Digital no âmbito do Poder Executivo Municipal e do
Poder Legislativo Municipal, e dá outras providências.

● EXTRATO DE CONTRATO Nº 13/2024  - Contratação de empresa especializada para realização de Cursos de Capacitação Técnica em Saúde,
no âmbito regido pelo SUS, voltado para a formação continuada da educação básica, para os profissionais do Município de Nossa Senhora de
Lourdes, Estado de Sergipe",698,False,https://querido-diario.nyc3.cdn.digitaloceanspaces.com/2804706/2024-05-22/566a7776ed6488afef85e714991185d7e7894063.txt
60,2800605,2024-05-22,2024-05-29T21:54:30.093847,https://querido-diario.nyc3.cdn.digitaloceanspaces.com/2800605/2024-05-22/1494000d5b47fb2e78db89366b03f7d2e2985853.pdf,Barra dos Coqueiros,SE,"Programa de Governo Digital de
Barra dos Coqueiros e os procedimentos iniciais a
serem adotados para formulação e implementação
de uma Estratégia de Transformação Digital no
âmbito dos órgãos e entidades da Administração
Pública Direta e Indireta do Município de Barra
dos Coqueiros.

O PREFEITO MUNICIPAL DE BARRA DOS COQUEIROS, ESTADO DE
SERGIPE, no uso das atribuições legais que lhe são conferidas pela Constituição Federal e

Lei Orgânica Municipal,

CONSIDERANDO as disposições da Lei Federal no 14.129, de 29 de março de 202 l, que

dispõe sobre princípios, regras e instrumentos para o Govemo Digital e para o aumento da

eficiência pública; e

CONSIDERANDO a necessidade de institucionalizar a Estratégia de Transformação
Digital de Barra dos Coqueiros, em conformidade com a Lei Federal, com o intuito de
prestar serviços públicos de qualidade, que aumentem a eficiência da administração,
especialmente por meio da desburocratização, da inovação, da transformação digital e da

participação do cidadão;",400,False,https://querido-diario.nyc3.cdn.digitaloceanspaces.com/2800605/2024-05-22/1494000d5b47fb2e78db89366b03f7d2e2985853.txt
61,4126702,2024-05-27,2024-05-29T20:58:19.891863,https://querido-diario.nyc3.cdn.digitaloceanspaces.com/4126702/2024-05-27/37b4cb120469b84c99f11eb92110adbc789b231c.pdf,Tamboara,PR,"            CEP 87760-000    -    TAMBOARA   -   PARANÁ

              76.978.519/0001-00

       

            DECRETO Nº 107/2024

INSTITUI  O  PROGRAMA  DE  GOVERNO
DIGITAL  NA  ADMINISTRAÇÃO  DO
MUNICÍPIO  DE  TAMBOARA/PR  E  DÁ
OUTRAS PROVIDÊNCIAS. 

ANTÔNIO  CARLOS  CAUNETO,  Prefeito  Municipal  de  Tamboara,
Estado do Paraná, no uso de suas atribuições legais; 

CONSIDERANDO os princípios norteadores da jornada autônoma do
usuário  externo/cidadão  preconizados  na  Lei  Federal  nº  14.129,  de  29  de

março  de  2021,  que  dispõe  sobre  princípios,  regras  e  instrumentos  para  o

Governo Digital e para o aumento da eficiência pública;

CONSIDERANDO o Decreto Federal nº 10.332, de 28 de abril de 2020,
que institui a Estratégia de Governo Digital para o período de 2020 a 2022, no

âmbito  dos  órgãos  e  das  entidades  da  administração  pública  federal  direta,

autárquica e fundacional e dá outras providências;

CONSIDERANDO a  necessidade  de  implementar  inovações ",797,False,https://querido-diario.nyc3.cdn.digitaloceanspaces.com/4126702/2024-05-27/37b4cb120469b84c99f11eb92110adbc789b231c.txt
62,5300108,2024-05-28,2024-05-28T23:50:15.611748,https://querido-diario.nyc3.cdn.digitaloceanspaces.com/5300108/2024-05-28/9df459473af86be07bb8252531d1687bf33a6cac.pdf,Brasília,DF,"129, de 16/09/2021, publicada no
DODF nº 176, de 17/09/2021, o ato que retificou a Ordem de Serviço Coletiva nº 107, de
29/07/2021, publicada no DODF nº 143, de 30/07/2021, concedeu pensão temporária à
HELLEN PORTO, filha do ex-servidor ROMUALDO MANOEL PORTO, matrícula nº
14.129-1, Técnico de Gestão Fazendária, Classe Especial, Padrão V, do Quadro de Pessoal do
Distrito Federal e incluiu como beneficiária de pensão vitalícia, CENITA DA SILVEIRA
PORTO, na qualidade de cônjuge do ex-servidor, a contar de 18/09/2021.
REVER, na Ordem de Serviço nº 1.074, de 29/07/2021, publicada no DODF nº 143, de
30/07/2021, o ato que concedeu pensão temporária à HELLEN PORTO, filha do ex-servidor
ROMUALDO MANOEL PORTO, matrícula nº 14.129-1, Técnico de Gestão Fazendária,
Classe Especial, Padrão V, do Quadro de Pessoal do Distrito Federal, para incluir como
beneficiária de pensão vitalícia MARIA NEUZA CAMACHO, companheira do ex-servidor,
de acordo como artigo 29, § 6º e 32, Parágrafo Único, da Lei Complementar",,False,https://querido-diario.nyc3.cdn.digitaloceanspaces.com/5300108/2024-05-28/9df459473af86be07bb8252531d1687bf33a6cac.txt
63,2704302,2024-05-28,2024-05-28T22:13:16.426159,https://querido-diario.nyc3.cdn.digitaloceanspaces.com/2704302/2024-05-28/e5fcc075ce9dfbe445d41155b7a51680b8feebbf.pdf,Maceió,AL,"MUNICIPAL DE MACEIÓ, no 

uso de suas atribuições legais e regimentais, 

  

CONSIDERANDO a indicação pelo Controlador Geral prevista no 

art. 5º, VIII, c/c art. 41, §1º, da Lei nº 13.709/2018; 

  

CONSIDERANDO o tratamento de dados pessoais pelo Poder 

Público para atendimento da sua finalidade pública, na persecução do 

interesse público, amparado no art. 23 da Lei nº 13.709/2018; 

  

COSIDERANDO, por fim, os princípios, regras e instrumentos 

previstos no art. 3º, XVII, da Lei nº 14.129/2022. 

  

RESOLVE: 

  

DESIGNAR a pessoa jurídica JEAN CHARLES PORTO NUNES 

– ME - (J. C. SOFTWARES), Contrato nº. 007/2022, inscrita no 

CNPJ/MF sob o nº. 02.508.916/0001-82, com sede na Rua Engenheiro 

R. G. Menezes, nº. 53 - CXPST 01 – Bairro: Centro – Maceió/AL - 

CEP Nº. 57.020-680, para DPO - RESPONSÁVEL PELO 

TRATAMENTO DE DADOS PESSOAIS E 

DISPONIBILIZADOS NOS CANAIS DE COMUNICAÇÃO DA 

CÂMARA MUNICIPAL DE MACEIÓ. 
  

DÊ-SE CIÊNCIA, PUBLIQUE-SE E CUMPRA-SE. 

  

GALBA NOVAIS",6935a,True,https://querido-diario.nyc3.cdn.digitaloceanspaces.com/2704302/2024-05-28/e5fcc075ce9dfbe445d41155b7a51680b8feebbf.txt
64,4113700,2024-06-03,2024-06-04T02:03:40.685013,https://querido-diario.nyc3.cdn.digitaloceanspaces.com/4113700/2024-06-03/f6036f06f0c849e43bd3895b5b6dc27eb2de86f2.pdf,Londrina,PR,"revogadas as disposições em contrário. 
  
Londrina, 27 de maio de 2024. Marcelo Belinati Martins, Prefeito do Município, João Luiz Martins Esteves, Secretário(a) Municipal de Governo, 
Janderson Marcelo Canhada, Secretário(a) Municipal de Planejamento, Orçamento e Tecnologia 

 
DECRETO Nº 667 DE 27 DE MAIO DE 2024 
  
SÚMULA: Regulamenta a Lei Federal nº 14.129, de 29 de março de 2021 no âmbito do Município de Londrina e dá outras providências. 
  
O PREFEITO DO MUNICÍPIO DE LONDRINA, ESTADO DO PARANÁ, no exercício de suas atribuições legais, que lhe são conferidas pela Lei 
Orgânica Municipal, 
 
CONSIDERANDO a Lei Federal nº 14.129, de 29 de março de 2021, que dispõe sobre princípios, regras e instrumentos para o Governo Digital; 
 
CONSIDERANDO a importância de se prestar serviços públicos de qualidade, que aumentem a eficiência da Administração, especialmente por meio 
da desburocratização, da inovação, da transformação digital e da participação do cidadão; 
  

DECRETA: 
  



Jornal",5212,False,https://querido-diario.nyc3.cdn.digitaloceanspaces.com/4113700/2024-06-03/f6036f06f0c849e43bd3895b5b6dc27eb2de86f2.txt
65,4113700,2024-06-03,2024-06-04T02:03:40.685013,https://querido-diario.nyc3.cdn.digitaloceanspaces.com/4113700/2024-06-03/f6036f06f0c849e43bd3895b5b6dc27eb2de86f2.pdf,Londrina,PR,"Jornal Oficial nº 5212 Pág. 4 Segunda-feira, 3 de junho de 2024 
 

CAPÍTULO I 
DAS DISPOSIÇÕES GERAIS 

  
Art. 1º Este decreto regulamenta o Governo Digital no âmbito da administração pública direta, autárquica e fundacional do Poder Executivo do Município 
de Londrina. 
 
Art. 2º Os conceitos, os princípios, as diretrizes e os instrumentos para implementação do Governo Digital em âmbito municipal observarão as normas 
gerais estabelecidas na Lei Federal nº 14.129, de 29 de março de 2021, na Lei Federal nº 14.063, de 23 de setembro de 2020 e em outras 
regulamentações aplicáveis ao processo eletrônico em âmbito municipal. 
  

CAPÍTULO II 
DO GOVERNO DIGITAL 

 
Art. 3º O Governo Digital por meio de soluções digitais deve promover a desburocratização, a modernização, o fortalecimento e a simplificação da 
relação do poder público com a sociedade incentivando a transparência na execução dos serviços públicos e a participação social no controle e 
fiscalização da administração pública. 
",5212,False,https://querido-diario.nyc3.cdn.digitaloceanspaces.com/4113700/2024-06-03/f6036f06f0c849e43bd3895b5b6dc27eb2de86f2.txt
66,4113700,2024-06-03,2024-06-04T02:03:40.685013,https://querido-diario.nyc3.cdn.digitaloceanspaces.com/4113700/2024-06-03/f6036f06f0c849e43bd3895b5b6dc27eb2de86f2.pdf,Londrina,PR,"congêneres, incluídos os de formato 
digital; 
IV - Recebimento de protocolo, físico ou digital, das solicitações apresentadas. 
  

CAPÍTULO IV 
DO GOVERNO COMO PLATAFORMA 

  
Seção I 

Da Abertura de Dados 
  
Art. 15. Os dados disponibilizados pelos prestadores de serviços públicos e qualquer informação de transparência ativa são de livre utilização pela 
sociedade, observados os princípios dispostos no art. 6º da Lei Federal nº 13.709, de 2018, e os requisitos previstos pela Lei Federal nº 14.129, de 
2021. 
 
§ 1º Sem prejuízo da legislação em vigor, os órgãos e as entidades municipais deverão divulgar na internet: 
 
I - o orçamento anual de despesas e receitas públicas do Poder ou órgão independente; 
II - a execução das despesas e receitas públicas, nos termos dos arts. 48 e 48-A da Lei Complementar nº 101, de 4 de maio de 2000; 
III - os repasses de recursos federais e estaduais ao Município; 
IV - os convênios e as operações de descentralização de recursos orçamentários em favor",5212,False,https://querido-diario.nyc3.cdn.digitaloceanspaces.com/4113700/2024-06-03/f6036f06f0c849e43bd3895b5b6dc27eb2de86f2.txt
67,4113700,2024-06-03,2024-06-04T02:03:40.685013,https://querido-diario.nyc3.cdn.digitaloceanspaces.com/4113700/2024-06-03/f6036f06f0c849e43bd3895b5b6dc27eb2de86f2.pdf,Londrina,PR,"individualizadas, dos dados dos beneficiários. 
 
§ 2º A abertura de dados poderá ocorrer por meio da execução de Plano de Dados Abertos no âmbito de cada órgão ou entidade da Administração 
Pública Direta, Autárquica e Fundacional, cujas regras e procedimentos deverão ser regulamentadas em decreto específico. 
 
Art. 16. Qualquer interessado poderá apresentar pedido de abertura de bases de dados da administração pública direta, autárquica e fundacional, 
observadas as regras previstas na Lei Federal nº 14.129, de 2021 e em regulamento específico. 
  

Seção II 
Da Interoperabilidade de Dados entre Órgãos Públicos 

  
Art. 17. Os órgãos responsáveis pela prestação digital de serviços públicos detentores ou gestores de bases de dados, inclusive os controladores de 
dados pessoais, deverão gerir suas ferramentas digitais, tendo em consideração: 
 
I - A interoperabilidade de informações e de dados sob sua gestão, respeitadas as restrições legais, os requisitos de segurança da informação e 
comunicação",5212,False,https://querido-diario.nyc3.cdn.digitaloceanspaces.com/4113700/2024-06-03/f6036f06f0c849e43bd3895b5b6dc27eb2de86f2.txt
68,4305108,2024-06-10,2024-06-11T02:41:56.346248,https://querido-diario.nyc3.cdn.digitaloceanspaces.com/4305108/2024-06-10/f25ce2c4461325f6224bca89cfab4571b990cea4.pdf,Caxias do Sul,RS,"e/ou certificação BPM
(Business Process Management); conhecimento sobre o
BPM CBOK; experiência em abordagens, conceitos,
métodos, técnicas e ferramentas de gerenciamento de
processos; conhecimento sobre a ISO 9001:2015.

01

Diretor(a) do
Escritório de

Gestão da
Transparência

Capacitações e treinamentos em cursos ou eventos
relacionados às práticas de transparência no setor
público; compreensão sobre a legislação que aborda a
matéria, em especial as Leis Federais nº 12.527/2011,
13.460/2017 e 14.129/2021.

01

 
2. Requisitos para inscrição:
a. possuir ensino superior completo;
b. possuir estabilidade no serviço público municipal;
c. possuir idoneidade moral;
d. não estar respondendo sindicância/processo administrativo disciplinar; e
e. conhecer e estar de acordo com as disposições contidas no Edital de Processo Seletivo n.º 01/2024;
 
3. Inscrições:
As inscrições deverão ser realizadas a partir das 9h (horário de Brasília) do dia 10 de junho de 2024 até às 23h59min (horário
de Brasília)",4554,False,https://querido-diario.nyc3.cdn.digitaloceanspaces.com/4305108/2024-06-10/f25ce2c4461325f6224bca89cfab4571b990cea4.txt
69,3528007,2024-06-12,2024-06-12T07:53:11.806195,https://querido-diario.nyc3.cdn.digitaloceanspaces.com/3528007/2024-06-12/fec1433c260b76fcbbf5a9653599eb4706d4bb46.pdf,Macatuba,SP,"preservação e integridade dos 

dados. 

  

Art. 8º A digitalização de documentos para a inserção no 

SEI/CIDADES observará as disposições: 

I - da Lei Federal nº 12.682, de 9 de julho de 2012, que dispõe sobre a 

elaboração e o arquivamento de documentos em meios 

eletromagnéticos; 

II - da Lei Federal nº 13.460, de 26 de junho de 2017, que dispõe 

sobre participação, proteção e defesa dos direitos do usuário dos 

serviços públicos da administração pública; e 

III - da Lei Federal nº 14.129, de 29 de março de 2021, que dispõe 

sobre princípios, regras e instrumentos para o Governo Digital e para 

o aumento da eficiência pública e dá outras providências. 

  

Art. 9º A digitalização de documentos recebidos ou produzidos no 

âmbito da Administração Pública Municipal será acompanhada da 

conferência da integridade do documento. 

§ 1º A conferência da integridade a que se refere o “caput” deste 

artigo deverá registrar se houve exibição de documento original, de 

cópia autenticada",1417,False,https://querido-diario.nyc3.cdn.digitaloceanspaces.com/3528007/2024-06-12/fec1433c260b76fcbbf5a9653599eb4706d4bb46.txt
70,3106200,2024-06-12,2024-06-12T11:24:34.582835,https://querido-diario.nyc3.cdn.digitaloceanspaces.com/3106200/2024-06-12/731be40b34aff8d5c0f5c29218a3c1544575fb7f.pdf,Belo Horizonte,MG,"
GABINETE DO PREFEITO

DECRETO Nº 18.727, DE 11 DE JUNHO DE 2024.

Dispõe sobre o Governo Digital no âmbito do 
Poder Executivo.

O PREFEITO DE BELO HORIZONTE, no exercício da atribuição que lhe confere o 
inciso VII do art. 108 da Lei Orgânica e considerando o disposto na Lei federal nº 14.129, de 
29 de março de 2021,

DECRETA:

Art. 1º – Este decreto dispõe sobre o Governo Digital no âmbito do Poder Executivo 
municipal e estabelece diretrizes gerais para a sua operacionalização.

Parágrafo único – A política de Governo Digital da administração pública municipal 
de que trata este decreto compreende também:

I – o Decreto nº 18.608, de 18 de janeiro de 2024, que regulamenta a Lei federal 
nº 13.709, de 14 de agosto de 2018, Lei Geral de Proteção de Dados Pessoais – LGPD –, no 
âmbito da administração direta e indireta do Poder Executivo.

II – o Decreto nº 18.342, de 14 de junho de 2023, que dispõe sobre a política de 
inovação aberta da Prefeitura de Belo Horizonte;

III – o Decreto",7025,False,https://querido-diario.nyc3.cdn.digitaloceanspaces.com/3106200/2024-06-12/731be40b34aff8d5c0f5c29218a3c1544575fb7f.txt
71,3106200,2024-06-12,2024-06-12T11:24:34.582835,https://querido-diario.nyc3.cdn.digitaloceanspaces.com/3106200/2024-06-12/731be40b34aff8d5c0f5c29218a3c1544575fb7f.pdf,Belo Horizonte,MG,"estratégias.

Art. 15 – Compete à SMPOG a coordenação da governança e da estratégia de 
Governo Digital da Prefeitura de Belo Horizonte, podendo expedir normas complementares 
à sua operacionalização. 

Art. 16 – Os conceitos, princípios, diretrizes e instrumentos para implementação 
do Governo Digital observarão as normas gerais de direito estabelecidas na Lei federal nº 
13.460, de 2017, na Lei federal nº 13.709, de 2018, na Lei federal nº 14.063, de 23 de 
setembro de 2020, e na Lei federal nº 14.129, de 29 de março de 2021.

Art. 17 – Fica revogado o Decreto nº 14.600, de 11 de outubro de 2011. 
Art. 18 – Este decreto entra em vigor na data de sua publicação.

Belo Horizonte, 11 de junho de 2024.

Fuad Noman
Prefeito de Belo Horizonte

DECRETO Nº 18.728, DE 11 DE JUNHO DE 2024.

Institui a Política de Inteligência de Dados no 
âmbito do Poder Executivo.

O PREFEITO DE BELO HORIZONTE, no exercício da atribuição que lhe confere o 
inciso VII do art. 108 da Lei Orgânica,

DECRETA:

Art. 1º",7025,False,https://querido-diario.nyc3.cdn.digitaloceanspaces.com/3106200/2024-06-12/731be40b34aff8d5c0f5c29218a3c1544575fb7f.txt
