,territory_id,date,scraped_at,url,territory_name,state_code,excerpts,edition,is_extra_edition,txt_url
0,3525904,2024-01-05,2024-01-06T01:42:10.781308,https://querido-diario.nyc3.cdn.digitaloceanspaces.com/3525904/2024-01-05/abe505b60a0f256b69b117c391e469e49880dc66.pdf,Jundiaí,SP,"físicos e conversão para processos administrativos 
eletrônicos, no âmbito da Administração Pública Direta do Município de 
Jundiaí.
SIMONE ZANOTELLO DE OLIVEIRA, Gestora da Unidade de 
Administração e Gestão de Pessoas do Município de Jundiaí, Estado 
de São Paulo, no uso de suas atribuições legais, face ao que consta 
do Processo Administrativo PMJ SEI 15744/2023, e tendo em vista as 
disposições constantes nas Leis Federais n°s 12.682, de 9 de julho de 
2012, 13.874, de 20 de setembro de 2019 e 14.129, de 29 de março de 
2021, Lei Municipal n° 5.349, de 17 de dezembro 1999, Decreto Municipal 
n° 26.136, de 06 de novembro 2015, Decreto Federal nº 10.278, de 18 
de março de 2020, RESOLVE:

CAPÍTULO I
OBJETO E ÂMBITO DE APLICAÇÃO

Art. 1º Fica regulamentado o procedimento de digitalização dos processos 
administrativos físicos para o Sistema Eletrônico de Informações-SEI no 
âmbito da Administração Pública Direta do Município de Jundiaí .
Art. 2º Para fins desta Instrução Normativa, considera-se:",5393,False,https://querido-diario.nyc3.cdn.digitaloceanspaces.com/3525904/2024-01-05/abe505b60a0f256b69b117c391e469e49880dc66.txt
1,3525904,2024-01-05,2024-01-06T01:42:10.781308,https://querido-diario.nyc3.cdn.digitaloceanspaces.com/3525904/2024-01-05/abe505b60a0f256b69b117c391e469e49880dc66.pdf,Jundiaí,SP,"inclusão do Termo de Encerramento de 
Processo citado no § 1º deste artigo, devendo ser inserido no SIIM – 
Protocolo a respectiva tramitação, com o status de “deferido”.

CAPÍTULO V
DAS DISPOSIÇÕES FINAIS

Art. 9º Na aplicação desta Instrução Normativa, deverão ser observadas 
as peculiaridades de cada tipo de documentação, principalmente no que 
tange às legislações vigentes, devendo ser observadas as Leis Federais 
n° 12.682, de 9 de julho de 2012, nº 13.874, de 20 de setembro de 2019 
e nº 14.129, de 29 de março de 2021, Lei Municipal n° 5.349, de 17 
de dezembro 1999, Decreto Municipal n° 26.136, de 06 de novembro 
de 2015, Decreto Federal nº 10.278, de 18 de março de 2020, no que 
couber, com relação aos assuntos pertinentes e não conflitantes tratados 
em cada uma delas.
Art. 10. No processo de digitalização, os responsáveis deverão 
observar,  no  que  couber  e  no  que  não  conflitar  com  esta  Instrução, 
os “Procedimentos para Digitalização de Documentos e Processos”, 
constantes",5393,False,https://querido-diario.nyc3.cdn.digitaloceanspaces.com/3525904/2024-01-05/abe505b60a0f256b69b117c391e469e49880dc66.txt
2,3525904,2024-01-05,2024-01-06T01:42:10.781308,https://querido-diario.nyc3.cdn.digitaloceanspaces.com/3525904/2024-01-05/abe505b60a0f256b69b117c391e469e49880dc66.pdf,Jundiaí,SP,"2024

Dispõe sobre o procedimento de cadastro e concessão de acesso a 
usuário externo no SEI – SISTEMA ELETRÔNICO DE INFORMAÇÔES, 
no âmbito da Administração Pública Direta do Município de Jundiaí.
SIMONE ZANOTELLO DE OLIVEIRA, Gestora da Unidade de 
Administração e Gestão de Pessoas do Município de Jundiaí, Estado 
de São Paulo, no uso de suas atribuições legais, face ao que consta 
do Processo Administrativo PMJ SEI 40748/2023, e tendo em vista as 
disposições constantes na Lei Federal n° 14.129, de 29 de março de 
2021, Lei Municipal n° 5.349, de 17 de dezembro 1999, Decreto Municipal 
n° 26.136, de 06 de novembro de 2015, Lei Federal nº 13.709, de 14 de 
agosto de 2018 e Lei Federal nº 13.726, de 8 de outubro de 2018.
RESOLVE:

CAPÍTULO I

DO OBJETO E ÂMBITO DE APLICAÇÃO
Art.1º Fica regulamentado o procedimento de cadastramento e 
concessão de acesso a usuários externos no SEI – Sistema Eletrônico 
de Informações no âmbito da Administração Pública Direta do Município 
de Jundiaí.
Art",5393,False,https://querido-diario.nyc3.cdn.digitaloceanspaces.com/3525904/2024-01-05/abe505b60a0f256b69b117c391e469e49880dc66.txt
3,3548708,2024-01-05,2024-01-06T02:35:10.646903,https://querido-diario.nyc3.cdn.digitaloceanspaces.com/3548708/2024-01-05/bfd29f00d713ea0cf234cc0ca9fdd01c2fdebe1a.pdf,São Bernardo do Campo,SP,"Manuais da organização. Gerenciamento de projetos. Gestão da
rotina de processos. Tecnologia de BPM e gerenciamento de processos.

Legislação
Lei de Acesso à Informação
LEI Nº 12.527, DE 18 DE NOVEMBRO DE 2011
DECRETO MUNICIPAL Nº 18.882, DE 28 DE ABRIL DE 2014
Lei Geral de Proteção de Dados
LEI Nº 13.709, DE 14 DE AGOSTO DE 2018
Direito do Usuário do Serviço Público
LEI Nº 13.460, DE 26 DE JUNHO DE 2017
DECRETO MUNICIPAL Nº 21.580, DE 1º DE JUNHO DE 2021 e suas alterações
Governo Digital
LEI Nº 14.129, DE 29 DE MARÇO DE 2021
Normas Processuais
DECRETO  MUNICIPAL  Nº  18.280,  DE  22  DE  NOVEMBRO  DE  2012  e  suas

alterações
Estatuto do Servidor Público de São Bernardo do Campo
Lei nº 1.729/1968 e alterações
ANALISTA DE TECNOLOGIA DA INFORMAÇÃO E COMUNICAÇÕES
Conhecimentos específicos:
Conceitos gerais:
Conceito  básico  de  software  e  hardware:  definição,  tipos,  funções  e

características.
Construção de algoritmos: tipos de dados simples e estruturados, variáveis

e constantes, comandos",2414,False,https://querido-diario.nyc3.cdn.digitaloceanspaces.com/3548708/2024-01-05/bfd29f00d713ea0cf234cc0ca9fdd01c2fdebe1a.txt
4,2301703,2024-01-09,2024-07-04T15:24:24.829784,https://querido-diario.nyc3.cdn.digitaloceanspaces.com/2301703/2024-01-09/e4c3947986cdd2a5c4991bf9fa917fe1bc7bfb30.pdf,Aurora,CE,"Municipal, bem 
como às leis orçamentárias;

V – fomento à competitividade nos certames, diminuindo a barreira de entrada a fornecedores em potencial;

VI – aprimoramento da interação com o mercado fornecedor, como forma de se promover a inovação e de 
se prospectarem soluções que maximizem a efetividade da contratação;

VII – desburocratização, incentivo à participação social, uso de linguagem simples e de tecnologia, bem 
como as demais diretrizes do Governo Digital, dispostas no art. 3º da Lei nº 14.129, de 29 de março de 
2021;

VIII – transparência processual;

IX – padronização e centralização de procedimentos, sempre que pertinente.

Art. 9º São instrumentos de governança nas contratações públicas, dentre outros:

I – Plano Diretor de Logística Sustentável - PLS;

II – Plano de Contratações Anual;

III – Política de gestão de estoques;

IV – Gestão por competências;

V – Gestão de riscos e controle preventivo;

VI – Diretrizes para a gestão dos contratos; e

VII – Definição de estrutura",575,False,https://querido-diario.nyc3.cdn.digitaloceanspaces.com/2301703/2024-01-09/e4c3947986cdd2a5c4991bf9fa917fe1bc7bfb30.txt
5,2910800,2024-01-17,2024-01-17T21:57:49.527161,https://querido-diario.nyc3.cdn.digitaloceanspaces.com/2910800/2024-01-17/c8172d99935e27ae5689438b18f0e59cb698870c.pdf,Feira de Santana,BA,"de integrar e engajar todos os servidores do Município, assim como 
otimizar serviços públicos para a coletividade;  

 

CONSIDERANDO a oportunidade de criação de ferramentas digitais que visem eficiência, celeridade e 
transparência dos procedimentos interno e externo;  

 

CONSIDERANDO a necessidade de agilizar e otimizar os recursos públicos, de eficiência na prestação de 
serviços à sociedade e de proximidade na relação entre Governo e cidadão; 

 

CONSIDERANDO o teor da Lei Federal Nº 14.129, de 29 março de 2021, que “Dispõe sobre princípios, regras 
e instrumentos para o aumento da eficiência da administração pública, especialmente por meio da 
desburocratização, da inovação, da transformação digital e da participação do cidadão”. 

 
DECRETA: 

 
 Art. 1º - Fica instituída a comunicação interna e externa eletrônica, via Memorando Eletrônico, Ofício 
Eletrônico e Protocolo Eletrônico, para a troca de documentos administrativos no âmbito da estrutura 
administrativa do Município",2725,False,https://querido-diario.nyc3.cdn.digitaloceanspaces.com/2910800/2024-01-17/c8172d99935e27ae5689438b18f0e59cb698870c.txt
6,3548500,2024-01-17,2024-01-17T04:32:43.823112,https://querido-diario.nyc3.cdn.digitaloceanspaces.com/3548500/2024-01-17/3de825aceef62dc8f7fb2453635cb352f4c93aa8.pdf,Santos,SP,"no âmbito deste IPREVSANTOS tem por ob-
jeto:

- Alcançar as vantagens e benefícios da informa-
tização e do uso de tecnologia para o desempenho 
das atividades da administração pública;

- Economia de recursos, a preservação do meio 
ambiente com a redução do uso de papel e outros 
insumos, bem como a promoção da desburocrati-
zação e da agilidade na tramitação dos processos 
administrativos e emissão de documentos e atos 
no âmbito do IPREVSANTOS;

– Atender às diretrizes da Lei Federal nº 14.129, 
de 29 de março de 2021, que dispõe sobre princí-
pios, regras e instrumentos para o Governo Digital 
e para o aumento da eficiência pública.

Art. 2º O uso de meio eletrônico busca padroni-
zar a comunicação, reduzir os gastos públicos, ofe-
recer maior transparência nos atos, registrar infor-
mações de atendimento aos segurados, aumentar 
a eficiência na prestação dos serviços, reduzir a 
quantidade de impressões e de papel circulante 
na entidade, e disponibilizar, em formato online, 
serviços",,False,https://querido-diario.nyc3.cdn.digitaloceanspaces.com/3548500/2024-01-17/3de825aceef62dc8f7fb2453635cb352f4c93aa8.txt
7,3525904,2024-01-24,2024-01-25T04:46:42.016522,https://querido-diario.nyc3.cdn.digitaloceanspaces.com/3525904/2024-01-24/b9122f60acd9f61ad2b336c8ddba46e658ac3e87.pdf,Jundiaí,SP,"2024

Dispõe sobre o procedimento de cadastro e concessão de acesso a 
usuário externo no SEI – SISTEMA ELETRÔNICO DE INFORMAÇÔES, 
no âmbito da Administração Pública Direta do Município de Jundiaí.
 SIMONE ZANOTELLO DE OLIVEIRA, Gestora da Unidade de 
Administração e Gestão de Pessoas do Município de Jundiaí, Estado 
de São Paulo, no uso de suas atribuições legais, face ao que consta 
do Processo Administrativo PMJ SEI 40748/2023, e tendo em vista as 
disposições constantes na Lei Federal n° 14.129, de 29 de março de 
2021, Lei Municipal n° 5.349, de 17 de dezembro 1999, Decreto Municipal 
n° 26.136, de 06 de novembro de 2015, Lei Federal nº 13.709, de 14 de 
agosto de 2018 e Lei Federal nº 13.726, de 8 de outubro de 2018.
 RESOLVE:

CAPÍTULO I
DO OBJETO E ÂMBITO DE APLICAÇÃO

Art.1º Fica regulamentado o procedimento de cadastramento e 
concessão de acesso a usuários externos no SEI – Sistema Eletrônico 
de Informações no âmbito da Administração Pública Direta do Município 
de Jundiaí.",5400,False,https://querido-diario.nyc3.cdn.digitaloceanspaces.com/3525904/2024-01-24/b9122f60acd9f61ad2b336c8ddba46e658ac3e87.txt
8,1721000,2024-02-08,2024-02-09T06:01:15.589668,https://querido-diario.nyc3.cdn.digitaloceanspaces.com/1721000/2024-02-08/f857598fbe631f7638f12e8e9eb23ef38911fa06.pdf,Palmas,TO,"

A PREFEITA DE PALMAS, no uso das atribuições que 
lhe confere o art. 71, inciso III, da Lei Orgânica do Município, e 
com fulcro no art. 2º, incisos I a XXIII, da Lei nº 2.390, de 21 de 



DIÁRIO OFICIAL DO MUNICÍPIO DE PALMAS Nº 3.402 - QUINTA-FEIRA, 8 DE FEVEREIRO DE 202410

junho de 2018, na Lei nº 8.159, de 8 de janeiro de 1991, na Medida 
Provisória nº 2.200-2, de 24 de agosto de 2001, na Resolução 
CONARQ nº de 6 de maio de 2022, na Lei nº 12.682, de 9 de julho 
de 2012, e na Lei nº 14.129, de 29 de março de 2021,

D E CR E T A:

CAPÍTULO I
DAS DISPOSIÇÕES PRELIMINARES

Art. 1º É instituído o Sistema e-Palmas como sistema 
informatizado de gestão arquivística de documentos, para a 
realização do Processo Administrativo Eletrônico (PAE), no âmbito 
dos órgãos e entidades da administração pública municipal, de uso 
obrigatório na produção, registro, criação, tramitação, consulta, 
transmissão e arquivamento de documentos e de processos 
administrativos, gerido pela Agência de Tecnologia",,False,https://querido-diario.nyc3.cdn.digitaloceanspaces.com/1721000/2024-02-08/f857598fbe631f7638f12e8e9eb23ef38911fa06.txt
9,1721000,2024-02-08,2024-02-09T06:01:15.589668,https://querido-diario.nyc3.cdn.digitaloceanspaces.com/1721000/2024-02-08/f857598fbe631f7638f12e8e9eb23ef38911fa06.pdf,Palmas,TO,"informar à AGTEC se o serviço pode ser requerido 
digitalmente ou somente de forma presencial. 

Parágrafo único. O serviço requerido presencialmente 
não obsta o uso do PAE, mediante a digitalização e a inserção no 
Sistema dos documentos originais apresentados pelo cidadão, os 
quais em nenhuma hipótese ficarão retidos pela administração.

Art. 16. A administração pública municipal deve presumir a 
boa-fé do usuário no relacionamento digital em atendimento ao art. 
3°, inciso XV, da Lei nº 14.129, de 29 de março de 2021.

Parágrafo único. A presunção de boa-fé do usuário não 
obsta a AGTEC de buscar meios para garantir a autenticação 
digital.

Art. 17. O mau uso do Portal do Cidadão pelo usuário 
externo não enseja responsabilização do servidor, que pode, em 
casos de suspeição, a qualquer momento, solicitar o contato, 
o comparecimento presencial do cidadão, o envio de dados 

complementares ou quaisquer outras medidas para garantir a 
continuidade da prestação do serviço.

Art. 18",,False,https://querido-diario.nyc3.cdn.digitaloceanspaces.com/1721000/2024-02-08/f857598fbe631f7638f12e8e9eb23ef38911fa06.txt
10,1721000,2024-02-08,2024-02-09T06:01:15.589668,https://querido-diario.nyc3.cdn.digitaloceanspaces.com/1721000/2024-02-08/f857598fbe631f7638f12e8e9eb23ef38911fa06.pdf,Palmas,TO,"com o uso do Portal do Cidadão e dos meios eletrônicos 
de comunicação nele informados, considerados tempestivos 
e suficientes o acesso e a leitura digital de comunicações, 
notificações e intimações.



DIÁRIO OFICIAL DO MUNICÍPIO DE PALMAS Nº 3.402 - QUINTA-FEIRA, 8 DE FEVEREIRO DE 202412

II - podem ser utilizadas mesmo que legislação especial 
preveja apenas as comunicações, as notificações e as intimações 
pessoais ou por via postal, tal como disposto no art. 43. do inciso 
III da Lei nº 14.129, de 29 de março de 2021.

CAPÍTULO VIII
DA ASSINATURA DIGITAL

Art. 26. As assinaturas eletrônicas serão reconhecidas nos 
termos do art. 4º da Lei nº 14.063, de 23 de setembro de 2020, 
distinguindo-se em:

I - assinatura eletrônica simples:

a) a que permite identificar o seu signatário;

b) a que anexa ou associa dados a outros dados em 
formato eletrônico do signatário;

II - assinatura eletrônica avançada: a que utiliza certificados 
não emitidos pela ICP-Brasil ou outro meio de comprovação",,False,https://querido-diario.nyc3.cdn.digitaloceanspaces.com/1721000/2024-02-08/f857598fbe631f7638f12e8e9eb23ef38911fa06.txt
11,2302800,2024-02-22,2024-07-04T15:37:15.931377,https://querido-diario.nyc3.cdn.digitaloceanspaces.com/2302800/2024-02-22/d3fd900ba721d219c8c3ad5b3b94ddde63b4b840.pdf,Canindé,CE,"MESES- 24 DE FEVEREIRO DE 2024 A 24 DE FEVEREIR O DE 2025 

 

ESTADO DO CEARÁ –MUNICIPIO DE CANINDE - EXTRATO DO PRIMEIRO ADITIVO REFERENTE AO CONTRATO Nº 20230202001 . 

DERIVADO DA CONTRATAÇÃO DIRETA Nº 2022151252. OBJETO DO CONTRATO: CONTRATAÇÃO DE EMPRESA PARA SERVIÇOS DE 

SISTEMA DE GESTAO DA INFORMAÇÃO COM LICENÇA ANUAL, PERIODO 12 (DOZE) MESES, PARA OTIMIZAÇÃO DOS PROCESSOS DE 

TRABALHO, COMUNICAÇÃO INTEGRADA DA ADMINISTRAÇÃO, EM ATENDIMENTO A LEI FEDERAL Nº 13.709/2018 (LGPD) E Nº 

14.129/2021, QUE DISPOE SOBRE PRINCIPIOS, REGRAS E INSTRUMENTO S PARA O AUMENTO DA EFICIENCIA DA ADMINISTRAÇÃO 

PUBLICA, ESPECIALMENTE POR MEIO DA DESBUROCRATIZAÇÃO, DA INOVAÇÃO, DA TRANSFORMAÇÃO DIGITAL E DA PARTICIPAÇÃO 

DO CIDADÃO PARA A PREFEITURA MUNICIPAL DE CANINDE -CE; OBJETO DO ADITIVO: PRORROGAÇÃO DE PRAZO POR IGUAL  



PÁG. 09 - DIÁRIO OFICIAL DO MUNICÍPIO Quinta-feira, 22 de Fevereiro de 2024 - Nº 714

INSTITUTO DE PREVIDÊNCIA 

PERIODO, A CONTAR DE 10 DE FEVEREIRO DE 2024 A 10 DE FEVEREIRO",714,False,https://querido-diario.nyc3.cdn.digitaloceanspaces.com/2302800/2024-02-22/d3fd900ba721d219c8c3ad5b3b94ddde63b4b840.txt
12,1501402,2024-02-28,2024-02-29T00:34:34.324331,https://querido-diario.nyc3.cdn.digitaloceanspaces.com/1501402/2024-02-28/47bc60c7f418cebca8575252a2f68d7eab5bb8f2.pdf,Belém,PA,"dispõe 
sobre o Sistema Único de Segurança Pública (SUSP) e cria a Política Nacional de 
Segurança Pública e Defesa Social (PNSPDS), em especial ao § 5º do Art. 22;

Considerando o disposto na Lei Federal nº 13.756, de 12/12/2018 que dispõe 
sobre o Fundo Nacional de Segurança Pública (FNSP), em especial ao Art. 9º, I;

Considerando o Decreto Federal nº 10.822 de 28/09/2021 que institui o Plano 
Nacional de Segurança Pública e Defesa Social 2021-2030;

Considerando o disposto na Lei Federal nº 14.129, de 29/03/2021 que dispõe 
sobre princípios, regras e instrumentos para o aumento da eficiência da administração 
pública, especialmente por meio da desburocratização, da inovação, da transformação 
digital e da participação do cidadão, em especial ao § 2º do Art. 2º;

R E S O L V E :
Art. 1º - AUTORIZAR a elaboração do Plano de Conversão Digital da Guarda 

Municipal de Belém - PCDigital/GMB, e do Plano Diretor de Tecnologia da Informação 
- PDTIC/GMB, e instituir o grupo de trabalho para a",14898,False,https://querido-diario.nyc3.cdn.digitaloceanspaces.com/1501402/2024-02-28/47bc60c7f418cebca8575252a2f68d7eab5bb8f2.txt
13,3525904,2024-03-13,2024-03-14T03:24:32.434548,https://querido-diario.nyc3.cdn.digitaloceanspaces.com/3525904/2024-03-13/39ab7f3bc5bc51d8a3ba4e19512ba0cad94c3ccd.pdf,Jundiaí,SP,"prazos para elaboração e revisão do Plano de 
Contratações Anual, no âmbito da Administração Direta do Município de 
Jundiaí, regulamentado no Decreto nº 33.221, de 29 de agosto de 2023.
 
SIMONE ZANOTELLO DE OLIVEIRA, Gestora da Unidade de Gestão 
de Administração e Gestão de Pessoas do Município de Jundiaí, Estado 
de São Paulo, no uso de suas atribuições legais, face ao que consta do 
Processo Administrativo PMJ SEI PMJ.0023374/2023 e tendo em vista 
as disposições constantes na Lei Federal n° 14.129, de 29 de março de 
2021, Lei Federal nº 14.133, de 1º de abril de 2021 e Decreto Municipal 
n° 33.221, de 29 de agosto 2023, RESOLVE:
 
 
Art. 1º. Até 15 de maio de cada ano, a Unidade Requisitante deverá 
preencher o documento para formalização de demanda, previsto no art. 
7º do Decreto Municipal nº 33.221, de 29 de agosto de 2023.
 
Art. 2º. Até 15 de junho de cada ano, setor de contratações concluirá a 
consolidação do plano de contratações anual, em conformidade com o 
disposto no art.",5426,False,https://querido-diario.nyc3.cdn.digitaloceanspaces.com/3525904/2024-03-13/39ab7f3bc5bc51d8a3ba4e19512ba0cad94c3ccd.txt
14,3304557,2024-03-13,2024-03-14T00:54:27.552377,https://querido-diario.nyc3.cdn.digitaloceanspaces.com/3304557/2024-03-13/8e690f3ca6071c8f24330d9f860b3c42e94401ad.pdf,Rio de Janeiro,RJ,"Autenticação: 8f76b77b



Diário Oicial do Município do Rio de Janeiro 
D.O.RIO

Ano XXXVII • No 244 • Rio de Janeiro Quarta-feira, 13 de Março de 202417

CONSIDERANDO a Lei Federal nº 14.129, de 29 de março de 2021, que dispõe sobre os princípios, regras e ins-
trumentos para o aumento da eiciência da administração pública, especialmente por meio da desburocratização, 
da inovação, da transformação digital e da participação do cidadão;

CONSIDERANDO o Decreto Rio Nº 53.909, de 31 de janeiro de 2024, que dispõe sobre as competências da 
Subsecretaria de Transformação Digital, da Secretaria Municipal da Casa Civil - CASA CIVIL, dentre outras;

RESOLVE:
Art. 1º Fica constituído Grupo de Trabalho para elaborar, no prazo de 60 dias, proposta de regulamentação da 
Lei Federal nº 14.063/2020 e da Lei Federal nº 14.129/2021 no âmbito do Município do Rio de Janeiro.

Art. 2º Ficam designados para compor o Grupo de Trabalho ora constituído, os servidores abaixo relacionados, 
sob a coordenação do primeiro:",,False,https://querido-diario.nyc3.cdn.digitaloceanspaces.com/3304557/2024-03-13/8e690f3ca6071c8f24330d9f860b3c42e94401ad.txt
15,1501402,2024-03-14,2024-03-15T01:29:07.743645,https://querido-diario.nyc3.cdn.digitaloceanspaces.com/1501402/2024-03-14/a00a01de5cd283f5827010e222863950d7129149.pdf,Belém,PA,"dispõe so-
bre o Sistema Único de Segurança Pública (Susp) e cria a Política Nacional de Segu-
rança Pública e Defesa Social (PNSPDS), em especial ao § 5º do Art. 22;

Considerando o disposto na Lei Federal nº 13.756, de 12/12/2018 que dispõe so-
bre o Fundo Nacional de Segurança Pública (FNSP), em especial ao Art. 9º, I;

Considerando o Decreto Federal nº 10.822 de 28/09/2021 que institui o Plano 
Nacional de Segurança Pública e Defesa Social 2021-2030;

Considerando o disposto na Lei Federal nº 14.129, de 29/03/2021 que dispõe so-
bre princípios, regras e instrumentos para o aumento da eficiência da administração 
pública, especialmente por meio da desburocratização, da inovação, da transformação 
digital e da participação do cidadão, em especial ao § 2º do Art. 2º;

R E S O L V E :
Art. 1º - AUTORIZAR a elaboração do Plano de Conversão Digital da Guarda 

Municipal de Belém - PCDigital/GMB, e do Plano Diretor de Tecnologia da Informa-
ção - PDTIC/GMB, e instituir o grupo de trabalho para",14907,False,https://querido-diario.nyc3.cdn.digitaloceanspaces.com/1501402/2024-03-14/a00a01de5cd283f5827010e222863950d7129149.txt
16,3531308,2024-03-19,2024-03-20T04:11:00.221755,https://querido-diario.nyc3.cdn.digitaloceanspaces.com/3531308/2024-03-19/3be76cc0bbb5f96c29e295e0e261ce3aaf790569.pdf,Monte Alto,SP,"que 
lhe confere o artigo 87, inciso XI, da Lei Orgânica do Município, e, 

 
 
DECRETA: 
 
 

CAPITULO I 
Disposições Gerais 

 
Art. 1º. Ficam adotados os princípios, regras e 

instrumentos para o aumento da eficiência da Administração Pública, 
especialmente por meio da desburocratização, da inovação, da 
transformação digital e da participação do cidadão, previstos na Lei Federal 
nº 14.129, de 29 de março de 2021, no âmbito dos órgãos e entidades do 
Poder Executivo do Município de Monte Alto. 
 

Parágrafo único. Na aplicação deste decreto deverá ser 
observado o disposto nas Leis Federais nº 14.129, de 29 de março de 2021, 
12.527, de 18 de novembro de 2011 (Lei de Acesso à Informação), 13.460, 
de 26 de junho de 2017, 13.709, de 14 de agosto de 2018 (Lei Geral de 
Proteção de Dados Pessoais), e 5.172, de 25 de outubro de 1966 (Código 
Tributário Nacional) e demais legislações pertinentes. 
 
   Art. 2º. Este decreto aplica-se: 
 
I – aos órgãos da Administração Pública direta Municipal",1566,False,https://querido-diario.nyc3.cdn.digitaloceanspaces.com/3531308/2024-03-19/3be76cc0bbb5f96c29e295e0e261ce3aaf790569.txt
17,2704302,2024-03-19,2024-03-19T06:41:04.763003,https://querido-diario.nyc3.cdn.digitaloceanspaces.com/2704302/2024-03-19/a50a4ccb01b3d9aed19a0c0517c36cd3e4415905.pdf,Maceió,AL,"pública. 5.1 Disposições gerais, servidores públicos. 

  

NOÇÕES DE INFORMÁTICA: 1 Noções do Sistema Operacional Windows (10 e 11). 2 MSOffice M365 (Word, Excel, Power Point, One Drive, 

Sharepoint e Teams). 3 Conceitos gerais de segurança da informação: proteção contra vírus e outras formas de softwares ou ações intrusivas. 4 

Dados: conceitos, atributos, métricas, transformação de dados. 5 Ciência de Dados: governança da informação. 6 Lei nº 13.709/2018, e suas 

atualizações. 7 Lei nº 14.129/2021. 8 Lei nº 12.527/2011. 

  

ATUALIDADES (SOMENTE PARA A PROVA DISCURSIVA): 1 Tópicos relevantes e atuais de diversas áreas, tais como segurança, 

transportes, política, economia, sociedade, educação, saúde, cultura, tecnologia, energia, relações internacionais, desenvolvimento sustentável e 

ecologia. 

  

CONHECIMENTOS ESPECÍFICOS 

CARGO 1: ANALISTA ADMINISTRATIVO 
ADMINISTRAÇÃO GERAL E PÚBLICA: 1 Evolução da administração. 1.1 Principais abordagens da administração (clássica até contingencial)",6888,False,https://querido-diario.nyc3.cdn.digitaloceanspaces.com/2704302/2024-03-19/a50a4ccb01b3d9aed19a0c0517c36cd3e4415905.txt
